<?xml version="1.0" encoding="UTF-8" standalone="yes"?>
<?xml-stylesheet type="text/css" href="forXML.css"?>
<students xmlns:xsi="http://www.w3.org/2001/XMLSchema-instance" xsi:noNamespaceSchemaLocation="doc3.xsd">
    <example count="3">
        <euniversity>Университет</euniversity>
        <ename>Имя</ename>
        <esurname>Фамилия</esurname>
        <eage>Возраст</eage>
    </example>
    <student>
        <university>БГТУ</university>
        <name>Алина</name>
        <surname>Темникова</surname>
        <age>20</age>
    </student>
    <student>
        <university>БГУИР</university>
        <name>Иван</name>
        <surname>Королов</surname>
        <age>21</age></student>
    <student>
        <university>БГУ</university>
        <name>Мария</name>
        <surname>Приморная</surname>
        <age>19</age></student>
</students>